{
  "artifact_id": "MATH-001-HUMAN-AUTHORITY-INPUT-TEMPLATE",
  "schema_version": "1.0.0",
  "instructions": "Copy this blank collection template into a future independently reviewed ingestion workflow. This artifact is not an ingestion interface, grants no authority, and must remain blank in v1.1. Codex does not self-attest.",
  "eligible_inputs": [
    {
      "input_id": "f9_maturity_horizon_days",
      "unit": "days",
      "owner": "authorized outcome-policy owner",
      "gate_id": "GATE-OUTCOME-LABELS-MATURITY-001"
    },
    {
      "input_id": "risk_aversion_policy",
      "unit": "dimensionless_utility_weight",
      "owner": "authorized firm decision-maker",
      "gate_id": "firm_economics_services_territories"
    },
    {
      "input_id": "minimum_meaningful_absolute_lift",
      "unit": "bookings_per_route_day",
      "owner": "authorized firm decision-maker",
      "gate_id": "firm_economics_services_territories"
    },
    {
      "input_id": "alpha",
      "unit": "probability",
      "owner": "authorized experimental protocol owner",
      "gate_id": "GATE-EXPERIMENT-PROTOCOL-001"
    },
    {
      "input_id": "target_power",
      "unit": "probability",
      "owner": "authorized experimental protocol owner",
      "gate_id": "GATE-EXPERIMENT-PROTOCOL-001"
    },
    {
      "input_id": "allocation_ratio",
      "unit": "ratio",
      "owner": "authorized experimental protocol owner",
      "gate_id": "GATE-EXPERIMENT-PROTOCOL-001"
    }
  ],
  "submission": {
    "input_id": null,
    "value": null,
    "issuer": null,
    "issued_at": null,
    "evidence_artifact": null,
    "artifact_sha256": null,
    "approval_scope": null
  },
  "ingestion_status": "NOT_AN_INGESTION_INTERFACE",
  "live_authority_granted": false
}
